Product,Price,Link
 La Barbería De Chacho  Suc. Villa Bosch,$10.500,https://inmueble.mercadolibre.com.ar/MLA-1394800017-la-barberia-de-chacho-suc-villa-bosch-_JM
Venta Monoambiente Santos Lugares ,$38.900,https://departamento.mercadolibre.com.ar/MLA-1557042808-venta-monoambiente-santos-lugares-_JM
"Departamento, Venta, Monoambiente, Saenz Peña, Santos Lugares",$32.000,https://departamento.mercadolibre.com.ar/MLA-1394659971-departamento-venta-monoambiente-saenz-pena-santos-lugares-_JM
Departamento - Villa Saenz Peña,$48.800,https://departamento.mercadolibre.com.ar/MLA-1394730815-departamento-villa-saenz-pena-_JM
Departamento 2 Amb En Alquiler En Martin Coronado,$170.000,https://departamento.mercadolibre.com.ar/MLA-1394807799-departamento-2-amb-en-alquiler-en-martin-coronado-_JM
Departamento En Alquiler En Santos Lugares,$220.000,https://departamento.mercadolibre.com.ar/MLA-1394732743-departamento-en-alquiler-en-santos-lugares-_JM
Mono Ambiente Con Balcon Al Contrafrente  Y A Una Cuadra De La Estacion. Tren Urquiza. Edificio De 8 Pisos Cocheras En Planta Baja Construido Con Mano De Obra Especializada,$32.800,https://departamento.mercadolibre.com.ar/MLA-1394798301-mono-ambiente-con-balcon-al-contrafrente-y-a-una-cuadra-de-la-estacion-tren-urquiza-edificio-de-8-pisos-cocheras-en-planta-baja-construido-con-mano-de-obra-especializada-_JM
Monoambiente Con Balcon Al Frente En Pleno Centro De Martin Coronado Y A Una Cuadra De La Estacion. Tren Urquiza. Edificio De 8 Pisos Cocheras En Planta Baja Construido Con Mano De Obra Especializada,$35.442,https://departamento.mercadolibre.com.ar/MLA-1394798223-monoambiente-con-balcon-al-frente-en-pleno-centro-de-martin-coronado-y-a-una-cuadra-de-la-estacion-tren-urquiza-edificio-de-8-pisos-cocheras-en-planta-baja-construido-con-mano-de-obra-especializada-_JM
